{
  "schema_version": "0.1",
  "experience": {
    "id": "exp_proto_002",
    "title": "THE SEALED EXPRESS",
    "premise": "On an interwar luxury night train, a famous jewel is discovered to be a replica after a tunnel blackout even though its locked display was never opened during the journey.",
    "player_question": "How was the jewel replaced without opening the display during the journey, and why was the tunnel blackout made to look like the critical moment?",
    "dramatic_spine": [
      "A blackout and alarm create an apparent impossible theft window.",
      "GAMMA appears suspicious because he controls train procedure and is evasive.",
      "A real procedural violation strengthens the false solution.",
      "That secret cannot explain evidence that predates the journey.",
      "BETA helps reframe the question from how the case was opened to when the real jewel last certainly existed.",
      "A pre-departure record proves the replica was already present.",
      "ALPHA's precision becomes evidence of privileged pre-departure access and knowledge.",
      "The player accuses the man whose ROLE was built around protecting the jewel."
    ],
    "truth": "ALPHA replaced the real jewel with a replica before departure and used the tunnel alarm as theatrical misdirection to create a false crime window. GAMMA conceals an unrelated procedural violation. BETA is genuinely investigating.",
    "resolution": "The player proves the jewel was already a replica before departure and identifies ALPHA as the person with the access and knowledge required to make the substitution."
  },
  "castings": [
    {"id": "cast_b_alpha", "prince_id": "prince_alpha", "role": {"label": "Exhibition curator and diplomatic aide", "description": "Responsible for pre-departure preparation and publicly dedicated to order; actually the culprit.", "narrative_function": "protector_culprit"}},
    {"id": "cast_b_beta", "prince_id": "prince_beta", "role": {"label": "Railway investigator", "description": "Official investigator whose person-centered instinct helps recover testimony other officials discount.", "narrative_function": "human_centered_ally"}},
    {"id": "cast_b_gamma", "prince_id": "prince_gamma", "role": {"label": "Chief conductor", "description": "Controls train procedure while bending one rule for an unrelated reason, becoming the initial red herring.", "narrative_function": "institutional_red_herring"}}
  ],
  "facts": [
    {"id": "f_b_01", "proposition": "The display seals remained intact throughout the journey.", "truth_value": "true", "canon": "hard"},
    {"id": "f_b_02", "proposition": "The jewel inside the display after the tunnel is a replica.", "truth_value": "true", "canon": "hard"},
    {"id": "f_b_03", "proposition": "A pre-departure image already shows the replica rather than the authenticated original.", "truth_value": "true", "canon": "hard"},
    {"id": "f_b_04", "proposition": "The substitution occurred during the tunnel blackout.", "truth_value": "false", "canon": "hard"},
    {"id": "f_b_05", "proposition": "GAMMA violated a train procedure during the journey.", "truth_value": "true", "canon": "soft"},
    {"id": "f_b_06", "proposition": "ALPHA had custody-level access before the display was sealed for departure.", "truth_value": "true", "canon": "hard"},
    {"id": "f_b_07", "proposition": "ALPHA demonstrates unusually precise knowledge of a distinctive feature of the authenticated original.", "truth_value": "true", "canon": "hard"},
    {"id": "f_b_08", "proposition": "ALPHA replaced the real jewel before departure.", "truth_value": "true", "canon": "hard"},
    {"id": "f_b_09", "proposition": "The tunnel alarm creates a memorable time boundary but does not prove physical access to the jewel.", "truth_value": "true", "canon": "hard"}
  ],
  "relations": [
    {"id": "r_b_01", "type": "contradicts", "from": "f_b_03", "to": "f_b_04", "description": "If the replica is visible before departure, the tunnel cannot be the substitution window."},
    {"id": "r_b_02", "type": "supports", "from": "f_b_01", "to": "f_b_03", "description": "Continuous seals push the meaningful access window before the journey."},
    {"id": "r_b_03", "type": "supports", "from": "f_b_06", "to": "f_b_08", "description": "ALPHA had the required pre-sealing opportunity."},
    {"id": "r_b_04", "type": "supports", "from": "f_b_07", "to": "f_b_08", "description": "ALPHA's privileged knowledge supports direct handling of the original."},
    {"id": "r_b_05", "type": "excludes", "from": "f_b_03", "to": "f_b_05", "description": "GAMMA's on-train procedural violation cannot explain a pre-departure substitution."}
  ],
  "knowledge": [
    {"holder": "player:initial", "fact_ids": ["f_b_01", "f_b_02"]},
    {"holder": "cast_b_alpha", "fact_ids": ["f_b_03", "f_b_04", "f_b_06", "f_b_07", "f_b_08", "f_b_09"]},
    {"holder": "cast_b_beta", "fact_ids": ["f_b_01", "f_b_02"]},
    {"holder": "cast_b_gamma", "fact_ids": ["f_b_05"]}
  ],
  "opportunities": [
    {"id": "op_b_01", "capability": "question_character", "targets": ["cast_b_gamma"], "requires_fact_ids": ["f_b_01", "f_b_02"], "reveals_fact_ids": ["f_b_05"], "description": "Expose GAMMA's procedural violation and create the first false solution."},
    {"id": "op_b_02", "capability": "inspect_information", "targets": ["pre_departure_image"], "requires_fact_ids": ["f_b_02"], "reveals_fact_ids": ["f_b_03"], "description": "Discover that the replica predates the tunnel event."},
    {"id": "op_b_03", "capability": "form_hypothesis", "targets": ["crime_window"], "requires_fact_ids": ["f_b_01", "f_b_03"], "reveals_fact_ids": ["f_b_04", "f_b_09"], "description": "Reject the tunnel as the true substitution window."},
    {"id": "op_b_04", "capability": "inspect_information", "targets": ["pre_departure_custody_record"], "requires_fact_ids": ["f_b_03"], "reveals_fact_ids": ["f_b_06"], "description": "Identify who had meaningful access before the display was sealed."},
    {"id": "op_b_05", "capability": "challenge_claim", "targets": ["cast_b_alpha"], "requires_fact_ids": ["f_b_03", "f_b_06"], "reveals_fact_ids": ["f_b_07"], "description": "Expose ALPHA's privileged knowledge of the authenticated original."},
    {"id": "op_b_06", "capability": "make_decision", "targets": ["cast_b_alpha", "cast_b_beta", "cast_b_gamma"], "success_target_ids": ["cast_b_alpha"], "requires_fact_ids": ["f_b_03", "f_b_04", "f_b_06", "f_b_07"], "reveals_fact_ids": ["f_b_08"], "description": "Choose who replaced the jewel before departure."
    }
  ],
  "completion_conditions": [
    {"id": "complete_b_01", "description": "Prove the tunnel was a false crime window and correctly accuse ALPHA as the pre-departure culprit.", "required_fact_ids": ["f_b_03", "f_b_04", "f_b_08"], "required_opportunity_ids": ["op_b_06"]}
  ],
  "capabilities": {"required": ["inspect_information", "question_character", "form_hypothesis", "challenge_claim", "make_decision"], "optional": []},
  "adaptation_policy": {
    "locked": ["experience.truth", "experience.player_question", "experience.resolution", "castings.prince_id", "castings.role.narrative_function"],
    "adaptive": ["experience.dramatic_spine pacing", "dialogue wording", "discovery order within fair-play constraints", "hint density"],
    "free": ["screen layout", "input method", "2D/3D presentation", "voice treatment", "animation", "camera"]
  }
}
